{
  "id": "region.desert_southwest",
  "schemaVersion": 1,
  "name": "Desert Southwest",
  "description": "A hot arid basin outside a growing desert city. Superb solar, severe water stress, gas-heavy evenings and an AI demand centre within reach.",
  "archetype": "desert",
  "climate": {
    "monthlyMeanTempC": [
      13,
      14.474,
      18.5,
      24,
      29.5,
      33.526,
      35,
      33.526,
      29.5,
      24,
      18.5,
      14.474
    ],
    "monthlySwingC": [
      14,
      14,
      14,
      14,
      14,
      14,
      14,
      14,
      14,
      14,
      14,
      14
    ],
    "monthlyHumidity01": [
      0.38,
      0.367,
      0.33,
      0.28,
      0.23,
      0.193,
      0.18,
      0.193,
      0.23,
      0.28,
      0.33,
      0.367
    ],
    "dailyVariabilityC": 3.2,
    "elevationM": 340,
    "contamination01": 0.35
  },
  "grid": {
    "capacityMw": 120,
    "basePricePerMwh": 62,
    "hourlyPriceShape": [
      1.019,
      0.825,
      0.643,
      0.486,
      0.364,
      0.285,
      0.254,
      0.275,
      0.345,
      0.46,
      0.611,
      0.789,
      0.981,
      1.175,
      1.357,
      1.514,
      1.636,
      1.715,
      1.746,
      1.725,
      1.655,
      1.54,
      1.389,
      1.211
    ],
    "monthlyPriceShape": [
      0.85,
      0.877,
      0.95,
      1.05,
      1.15,
      1.223,
      1.25,
      1.223,
      1.15,
      1.05,
      0.95,
      0.877
    ],
    "baseCarbonKgPerMwh": 385,
    "hourlyCarbonShape": [
      1.374,
      1.284,
      1.174,
      1.052,
      0.927,
      0.807,
      0.7,
      0.614,
      0.553,
      0.524,
      0.526,
      0.561,
      0.626,
      0.716,
      0.826,
      0.948,
      1.073,
      1.193,
      1.3,
      1.386,
      1.447,
      1.476,
      1.474,
      1.439
    ],
    "hourlyOutageProbability": 0.00035,
    "meanOutageHours": 2.5,
    "annualPriceDrift": 0.012,
    "annualCarbonDrift": -0.028
  },
  "water": {
    "annualWithdrawalLimitM3": 420000,
    "pricePerM3": 2.35,
    "stress01": 0.88,
    "reclaimedAvailability01": 0.65,
    "reclaimedPricePerM3": 0.95,
    "annualDroughtProbability": 0.28
  },
  "land": {
    "pricePerHectare": 95000,
    "availableHectares": 60,
    "biodiversitySensitivity01": 0.45,
    "brownfield": false,
    "constructionCostFactor": 0.95
  },
  "connectivity": {
    "latencyMsToDemandCentre": 12,
    "fiberCapacityGbps": 8000,
    "routeDiversity": 2,
    "transitCostPerGbpsMonth": 38
  },
  "people": {
    "laborSupply01": 0.55,
    "wageIndex": 0.94,
    "communitySensitivity01": 0.68,
    "populationDensity": 140,
    "startingTrust": 5
  },
  "hazards": {
    "heatWave": 0.85,
    "drought": 0.8,
    "flood": 0.15,
    "storm": 0.2,
    "wildfire": 0.35,
    "earthquake": 0.12,
    "seaLevel": 0
  },
  "policy": {
    "permitDays": 210,
    "carbonPricePerTonne": 18,
    "waterRestrictionFactor": 2.4,
    "capitalIncentive01": 0.08,
    "taxRate01": 0.21,
    "reportingMandatory": true
  },
  "resourceQuality": {
    "power.solar_rooftop": 0.27,
    "power.solar_ground": 0.29,
    "power.wind_contract": 0.24,
    "power.hydro_contract": 0.12,
    "power.gas_ccgt": 0.9,
    "power.diesel_backup": 0.95,
    "power.nuclear_contract": 0.9,
    "power.hydrogen_generator": 0.8,
    "power.smr": 0.92,
    "power.grid": 1,
    "power.battery": 1
  }
}
